### ISSUE TITLE
Perfect the only thing is it was not working

### ISSUE THREAD

**Issue by http600** [shadowsocks/v2ray-plugin#288]
My server is `1.2.3.4`, I can ssh login `ssh -o ServerAliveInterval=60 -D 1025 1.2.3.4 -lroot`, it provided socks proxy at `:1025` in such way, the proxy is working fine, I can visit those sites that I can't if I turn off the proxy
But is was annoying for me to setup ssh proxy every time, I want to setup shadowsocks proxy

Server Side
```
work@host:~/workspace/v2ray-plugin$ git rev-parse HEAD
ddd7ab46b4aeee0ca8b272efed9d7da3e3a6e52c
work@host:~/workspace/v2ray-plugin$ ~/go/bin/go1.16 build
work@host:~/workspace/v2ray-plugin$ pushd ../go-shadowsocks2/
~/workspace/go-shadowsocks2 ~/workspace/v2ray-plugin ~
work@host:~/workspace/go-shadowsocks2$ git rev-parse HEAD
71a35d3383128957db1327991445fca643feb4e2
work@host:~/workspace/go-shadowsocks2$ go build
work@host:~/workspace/go-shadowsocks2$ /home/work/workspace/go-shadowsocks2/go-shadowsocks2 -s 'ss://AEAD_CHACHA20_POLY1305:shadowsocks2022@:2022' -plugin /home/work/workspace/v2ray-plugin/v2ray-plugin -plugin-opts "server" --verbose
2022/07/09 17:04:16 plugin.go:16: starting plugin (/home/work/workspace/v2ray-plugin/v2ray-plugin) with option (server)....
2022/07/09 17:04:16 plugin.go:31: plugin (/home/work/workspace/v2ray-plugin/v2ray-plugin) will listen on 0.0.0.0:2022
2022/07/09 17:04:16 tcp.go:103: listening TCP on 127.0.0.1:35125
2022/07/09 17:04:16 log.go:23: [/home/work/workspace/v2ray-plugin/v2ray-plugin]: 2022/07/09 17:04:16 V2Ray 4.38.3 (V2Fly, a community-driven edition of V2Ray.) Custom (go1.16 linux/amd64)

2022/07/09 17:04:16 log.go:23: [/home/work/workspace/v2ray-plugin/v2ray-plugin]: 2022/07/09 17:04:16 A unified platform for anti-censorship.

2022/07/09 17:04:16 log.go:23: [/home/work/workspace/v2ray-plugin/v2ray-plugin]: 2022/07/09 17:04:16 [Warning] V2Ray 4.38.3 started

```

Client Side
```
➜  v2ray-plugin git:(master) git rev-parse HEAD                    
ddd7ab46b4aeee0ca8b272efed9d7da3e3a6e52c
➜  v2ray-plugin git:(master) ~/go/bin/go1.16.15 build
➜  v2ray-plugin git:(master) pushd ../go-shadowsocks2 
~/Downloads/workspace/go-shadowsocks2 ~/Downloads/workspace/v2ray-plugin ~
➜  go-shadowsocks2 git:(master) ✗ git rev-parse HEAD                                                                             
71a35d3383128957db1327991445fca643feb4e2
➜  go-shadowsocks2 git:(master) ✗ go build
➜  go-shadowsocks2 git:(master) ✗ ~/Downloads/workspace/go-shadowsocks2/go-shadowsocks2 -c 'ss://AEAD_CHACHA20_POLY1305:shadowsocks2022@1.2.3.4:2022' -plugin ~/Downloads/workspace/v2ray-plugin/v2ray-plugin -socks :1026 -verbose 
2022/07/10 01:06:35 plugin.go:16: starting plugin (/Users/xyz/Downloads/workspace/v2ray-plugin/v2ray-plugin) with option ()....
2022/07/10 01:06:35 plugin.go:33: plugin (/Users/xyz/Downloads/workspace/v2ray-plugin/v2ray-plugin) will listen on 127.0.0.1:53375
2022/07/10 01:06:35 tcp.go:18: SOCKS proxy :1026 <-> 127.0.0.1:53375
2022/07/10 01:06:35 log.go:23: [/Users/xyz/Downloads/workspace/v2ray-plugin/v2ray-plugin]: 2022/07/10 01:06:35 V2Ray 4.38.3 (V2Fly, a community-driven edition of V2Ray.) Custom (go1.16.15 darwin/amd64)
2022/07/10 01:06:35 A unified platform for anti-censorship.

2022/07/10 01:06:35 log.go:23: [/Users/xyz/Downloads/workspace/v2ray-plugin/v2ray-plugin]: 2022/07/10 01:06:35 [Warning] V2Ray 4.38.3 started
```

So far so good, but it was not working actually, And the most important thing is I have no idea how to locate the cause and how to fix it, those are the logs at client side
```
2022/07/10 01:15:51 log.go:23: [/Users/xyz/Downloads/workspace/v2ray-plugin/v2ray-plugin]: 2022/07/10 01:15:51 127.0.0.1:53443 accepted tcp:127.0.0.1:0

2022/07/10 01:15:51 tcp.go:87: proxy 127.0.0.1:53442 <-> 127.0.0.1:53375 <-> www.google.com:443
2022/07/10 01:15:52 tcp.go:87: proxy 127.0.0.1:53445 <-> 127.0.0.1:53375 <-> google.com:80
2022/07/10 01:15:52 tcp.go:87: proxy 127.0.0.1:53446 <-> 127.0.0.1:53375 <-> google.com:80
2022/07/10 01:15:52 log.go:23: [/Users/xyz/Downloads/workspace/v2ray-plugin/v2ray-plugin]: 2022/07/10 01:15:52 127.0.0.1:53448 accepted tcp:127.0.0.1:0
2022/07/10 01:15:52 127.0.0.1:53447 accepted tcp:127.0.0.1:0

2022/07/10 01:15:52 tcp.go:87: proxy 127.0.0.1:53451 <-> 127.0.0.1:53375 <-> www.gstatic.com:443
2022/07/10 01:15:52 log.go:23: [/Users/xyz/Downloads/workspace/v2ray-plugin/v2ray-plugin]: 2022/07/10 01:15:52 127.0.0.1:53452 accepted tcp:127.0.0.1:0

2022/07/10 01:15:52 tcp.go:87: proxy 127.0.0.1:53454 <-> 127.0.0.1:53375 <-> apis.google.com:443
2022/07/10 01:15:52 log.go:23: [/Users/xyz/Downloads/workspace/v2ray-plugin/v2ray-plugin]: 2022/07/10 01:15:52 127.0.0.1:53455 accepted tcp:127.0.0.1:0

2022/07/10 01:15:55 tcp.go:87: proxy 127.0.0.1:53458 <-> 127.0.0.1:53375 <-> www.google.com:443
2022/07/10 01:15:55 log.go:23: [/Users/xyz/Downloads/workspace/v2ray-plugin/v2ray-plugin]: 2022/07/10 01:15:55 127.0.0.1:53459 accepted tcp:127.0.0.1:0


2022/07/10 01:16:22 tcp.go:87: proxy 127.0.0.1:53470 <-> 127.0.0.1:53375 <-> apis.google.com:443
2022/07/10 01:16:22 tcp.go:87: proxy 127.0.0.1:53469 <-> 127.0.0.1:53375 <-> www.gstatic.com:443
2022/07/10 01:16:22 log.go:23: [/Users/xyz/Downloads/workspace/v2ray-plugin/v2ray-plugin]: 2022/07/10 01:16:22 127.0.0.1:53472 accepted tcp:127.0.0.1:0

2022/07/10 01:16:22 log.go:23: [/Users/xyz/Downloads/workspace/v2ray-plugin/v2ray-plugin]: 2022/07/10 01:16:22 127.0.0.1:53471 accepted tcp:127.0.0.1:0

2022/07/10 01:16:22 tcp.go:87: proxy 127.0.0.1:53475 <-> 127.0.0.1:53375 <-> www.google.com:443
2022/07/10 01:16:22 log.go:23: [/Users/xyz/Downloads/workspace/v2ray-plugin/v2ray-plugin]: 2022/07/10 01:16:22 127.0.0.1:53476 accepted tcp:127.0.0.1:0

2022/07/10 01:16:30 tcp.go:87: proxy 127.0.0.1:53484 <-> 127.0.0.1:53375 <-> www.google.com:443
2022/07/10 01:16:30 log.go:23: [/Users/xyz/Downloads/workspace/v2ray-plugin/v2ray-plugin]: 2022/07/10 01:16:30 127.0.0.1:53485 accepted tcp:127.0.0.1:0
```

**Comment by http600** [comment]
@madeye @icpz @hitian @zonyitoo @linusyang @honwen @teddysun @VictoriaRaymond @IceCodeNew @esrrhs @wyzdot @nullstd @lixin9311 hey, can you give some suggestion about investigating the problem, thanks.

**Comment by IceCodeNew** [comment]
You are not asking questions in a good manner. I won't give you any suggestions except STOP SPAMMING.

**Comment by http600** [comment]
No offense, really don't know what happened, whatever it was, I didn't mean it, and has no intention to tigger anything offensive, why would I, the problems puzzles me months, I was wondering it was only me or else, the reason why ated all guys is that, I'm really not sure is this project still active or not, for the reason of well-known, that is I don't know whom I should ask, sorry again, for all contributes.

**Comment by zonyitoo** [comment]
You didn't provide enough information about your problem. You just said "not working", what is "not working"? And how could others reproduce your problem?

**Comment by http600** [comment]
That was a mistake, too familiar to this problem to attach the related information

The case is Remote port is reachable, but TCP connection was failed to establish, v2ray was not reponding TCP SYN request as to the case

#### reversion server
```
v2ray-plugin$ git rev-parse HEAD
ddd7ab46b4aeee0ca8b272efed9d7da3e3a6e52c
go-shadowsocks2$ git rev-parse HEAD
71a35d3383128957db1327991445fca643feb4e2
```
#### reversion client
```
go-shadowsocks2 git:(master) git rev-parse HEAD         
71a35d3383128957db1327991445fca643feb4e2
v2ray-plugin git:(master) git rev-parse HEAD
ddd7ab46b4aeee0ca8b272efed9d7da3e3a6e52c
```
#### server go version
```
go version go1.16 linux/amd64
```
#### client go version
```
go version go1.16.15 darwin/amd64
```
#### build server
```
v2ray-plugin$ ./build-release.sh
go-shadowsocks2$ make
```
#### build client proxy
```
v2ray-plugin git:(master) ./build-release.sh
go-shadowsocks2 git:(master) make
```
#### start server
```
$ /home/work/workspace/go-shadowsocks2/bin/shadowsocks2-linux-amd64 -s 'ss://AEAD_CHACHA20_POLY1305:shadowsocks2022@:2022' -plugin /home/work/workspace/v2ray-plugin/v2ray-plugin_linux_amd64 -plugin-opts "server" --verbose
```
#### start client proxy
```
~/Downloads/workspace/go-shadowsocks2/bin/shadowsocks2-macos-amd64 -c 'ss://AEAD_CHACHA20_POLY1305:shadowsocks2022@1.2.3.4:2022' -plugin ~/Downloads/workspace/v2ray-plugin/v2ray-plugin_darwin_amd64 -socks :1026 -verbose
```
then visit google.com in chrome through SOCKS proxy :1026
#### log at client side, relay got EOF error
```
2022/07/20 02:30:07 plugin.go:16: starting plugin (/Users/xyz/Downloads/workspace/v2ray-plugin/v2ray-plugin_darwin_amd64) with option ()....
2022/07/20 02:30:07 plugin.go:33: plugin (/Users/xyz/Downloads/workspace/v2ray-plugin/v2ray-plugin_darwin_amd64) will listen on 127.0.0.1:51598
2022/07/20 02:30:07 tcp.go:18: SOCKS proxy :1026 <-> 127.0.0.1:51598
2022/07/20 02:30:07 log.go:23: [/Users/xyz/Downloads/workspace/v2ray-plugin/v2ray-plugin_darwin_amd64]: 2022/07/20 02:30:07 V2Ray 4.38.3 (V2Fly, a community-driven edition of V2Ray.) Custom (go1.16.15 darwin/amd64)
2022/07/20 02:30:07 A unified platform for anti-censorship.

2022/07/20 02:30:07 log.go:23: [/Users/xyz/Downloads/workspace/v2ray-plugin/v2ray-plugin_darwin_amd64]: 2022/07/20 02:30:07 [Warning] V2Ray 4.38.3 started

2022/07/20 02:36:23 log.go:23: [/Users/xyz/Downloads/workspace/v2ray-plugin/v2ray-plugin_darwin_amd64]: 2022/07/20 02:36:23 127.0.0.1:51675 accepted tcp:127.0.0.1:0

2022/07/20 02:36:23 tcp.go:87: proxy 127.0.0.1:51674 <-> 127.0.0.1:51598 <-> www.google.com:443
2022/07/20 02:36:24 tcp.go:87: proxy 127.0.0.1:51678 <-> 127.0.0.1:51598 <-> google.com:80
2022/07/20 02:36:24 log.go:23: [/Users/xyz/Downloads/workspace/v2ray-plugin/v2ray-plugin_darwin_amd64]: 2022/07/20 02:36:24 127.0.0.1:51679 accepted tcp:127.0.0.1:0

2022/07/20 02:36:24 tcp.go:87: proxy 127.0.0.1:51677 <-> 127.0.0.1:51598 <-> google.com:80
2022/07/20 02:36:24 log.go:23: [/Users/xyz/Downloads/workspace/v2ray-plugin/v2ray-plugin_darwin_amd64]: 2022/07/20 02:36:24 127.0.0.1:51682 accepted tcp:127.0.0.1:0

2022/07/20 02:36:24 log.go:23: [/Users/xyz/Downloads/workspace/v2ray-plugin/v2ray-plugin_darwin_amd64]: 2022/07/20 02:36:24 127.0.0.1:51683 accepted tcp:127.0.0.1:0

2022/07/20 02:36:24 tcp.go:87: proxy 127.0.0.1:51681 <-> 127.0.0.1:51598 <-> www.gstatic.com:443
2022/07/20 02:36:27 tcp.go:87: proxy 127.0.0.1:51686 <-> 127.0.0.1:51598 <-> www.google.com:443
2022/07/20 02:36:27 log.go:23: [/Users/xyz/Downloads/workspace/v2ray-plugin/v2ray-plugin_darwin_amd64]: 2022/07/20 02:36:27 127.0.0.1:51687 accepted tcp:127.0.0.1:0

2022/07/20 02:36:54 tcp.go:87: proxy 127.0.0.1:51702 <-> 127.0.0.1:51598 <-> www.gstatic.com:443
2022/07/20 02:36:54 log.go:23: [/Users/xyz/Downloads/workspace/v2ray-plugin/v2ray-plugin_darwin_amd64]: 2022/07/20 02:36:54 127.0.0.1:51703 accepted tcp:127.0.0.1:0

2022/07/20 02:36:54 tcp.go:87: proxy 127.0.0.1:51705 <-> 127.0.0.1:51598 <-> www.google.com:443
2022/07/20 02:36:54 log.go:23: [/Users/xyz/Downloads/workspace/v2ray-plugin/v2ray-plugin_darwin_amd64]: 2022/07/20 02:36:54 127.0.0.1:51706 accepted tcp:127.0.0.1:0

2022/07/20 02:37:02 tcp.go:87: proxy 127.0.0.1:51713 <-> 127.0.0.1:51598 <-> www.google.com:443
2022/07/20 02:37:02 log.go:23: [/Users/xyz/Downloads/workspace/v2ray-plugin/v2ray-plugin_darwin_amd64]: 2022/07/20 02:37:02 127.0.0.1:51714 accepted tcp:127.0.0.1:0

2022/07/20 02:37:51 tcp.go:89: relay error: EOF
2022/07/20 02:37:51 tcp.go:89: relay error: EOF
2022/07/20 02:37:54 tcp.go:87: proxy 127.0.0.1:51737 <-> 127.0.0.1:51598 <-> www.google.com:443
2022/07/20 02:37:54 tcp.go:87: proxy 127.0.0.1:51738 <-> 127.0.0.1:51598 <-> www.gstatic.com:443
2022/07/20 02:37:54 log.go:23: [/Users/xyz/Downloads/workspace/v2ray-plugin/v2ray-plugin_darwin_amd64]: 2022/07/20 02:37:54 127.0.0.1:51740 accepted tcp:127.0.0.1:0
2022/07/20 02:37:54 127.0.0.1:51739 accepted tcp:127.0.0.1:0

2022/07/20 02:38:24 tcp.go:87: proxy 127.0.0.1:51747 <-> 127.0.0.1:51598 <-> www.gstatic.com:80
2022/07/20 02:38:24 log.go:23: [/Users/xyz/Downloads/workspace/v2ray-plugin/v2ray-plugin_darwin_amd64]: 2022/07/20 02:38:24 127.0.0.1:51748 accepted tcp:127.0.0.1:0

2022/07/20 02:39:24 tcp.go:87: proxy 127.0.0.1:51769 <-> 127.0.0.1:51598 <-> www.gstatic.com:443
2022/07/20 02:39:24 tcp.go:87: proxy 127.0.0.1:51768 <-> 127.0.0.1:51598 <-> www.google.com:443
2022/07/20 02:39:24 log.go:23: [/Users/xyz/Downloads/workspace/v2ray-plugin/v2ray-plugin_darwin_amd64]: 2022/07/20 02:39:24 127.0.0.1:51770 accepted tcp:127.0.0.1:0
2022/07/20 02:39:24 127.0.0.1:51771 accepted tcp:127.0.0.1:0

2022/07/20 02:39:51 tcp.go:89: relay error: EOF
```
#### tcpdump server side, server side was not sending back packets
```
~# tcpdump -iany port 2022 -c 30 -n -q
tcpdump: data link type LINUX_SLL2
tcpdump: verbose output suppressed, use -v[v]... for full protocol decode
listening on any, link-type LINUX_SLL2 (Linux cooked v2), snapshot length 262144 bytes
18:43:33.993980 enp1s0 In  IP 58.37.11.251.51931 > 1.2.3.4.2022: tcp 0
18:43:34.108922 enp1s0 In  IP 58.37.11.251.51932 > 1.2.3.4.2022: tcp 0
18:43:34.151035 enp1s0 In  IP 58.37.11.251.51935 > 1.2.3.4.2022: tcp 0
18:43:34.453125 enp1s0 In  IP 58.37.11.251.51931 > 1.2.3.4.2022: tcp 0
18:43:34.511947 enp1s0 In  IP 58.37.11.251.51936 > 1.2.3.4.2022: tcp 0
18:43:34.567361 enp1s0 In  IP 58.37.11.251.51932 > 1.2.3.4.2022: tcp 0
18:43:34.605477 enp1s0 In  IP 58.37.11.251.51935 > 1.2.3.4.2022: tcp 0
18:43:34.911764 enp1s0 In  IP 58.37.11.251.51931 > 1.2.3.4.2022: tcp 0
18:43:34.974067 enp1s0 In  IP 58.37.11.251.51936 > 1.2.3.4.2022: tcp 0
18:43:35.025875 enp1s0 In  IP 58.37.11.251.51932 > 1.2.3.4.2022: tcp 0
18:43:35.065056 enp1s0 In  IP 58.37.11.251.51935 > 1.2.3.4.2022: tcp 0
18:43:35.415478 enp1s0 In  IP 58.37.11.251.51931 > 1.2.3.4.2022: tcp 0
18:43:35.432693 enp1s0 In  IP 58.37.11.251.51936 > 1.2.3.4.2022: tcp 0
18:43:35.485197 enp1s0 In  IP 58.37.11.251.51932 > 1.2.3.4.2022: tcp 0
18:43:35.524303 enp1s0 In  IP 58.37.11.251.51935 > 1.2.3.4.2022: tcp 0
18:43:35.890885 enp1s0 In  IP 58.37.11.251.51936 > 1.2.3.4.2022: tcp 0
18:43:35.941417 enp1s0 In  IP 58.37.11.251.51932 > 1.2.3.4.2022: tcp 0
18:43:35.982912 enp1s0 In  IP 58.37.11.251.51935 > 1.2.3.4.2022: tcp 0
18:43:36.350624 enp1s0 In  IP 58.37.11.251.51936 > 1.2.3.4.2022: tcp 0
18:43:36.423299 enp1s0 In  IP 58.37.11.251.51931 > 1.2.3.4.2022: tcp 0
18:43:36.439736 enp1s0 In  IP 58.37.11.251.51935 > 1.2.3.4.2022: tcp 0
18:43:36.444380 enp1s0 In  IP 58.37.11.251.51932 > 1.2.3.4.2022: tcp 0
18:43:36.808620 enp1s0 In  IP 58.37.11.251.51936 > 1.2.3.4.2022: tcp 0
18:43:36.941626 enp1s0 In  IP 58.37.11.251.51935 > 1.2.3.4.2022: tcp 0
18:43:37.312909 enp1s0 In  IP 58.37.11.251.51936 > 1.2.3.4.2022: tcp 0
18:43:37.449237 enp1s0 In  IP 58.37.11.251.51932 > 1.2.3.4.2022: tcp 0
18:43:37.946429 enp1s0 In  IP 58.37.11.251.51935 > 1.2.3.4.2022: tcp 0
18:43:38.317107 enp1s0 In  IP 58.37.11.251.51936 > 1.2.3.4.2022: tcp 0
18:43:38.430689 enp1s0 In  IP 58.37.11.251.51931 > 1.2.3.4.2022: tcp 0
18:43:39.458377 enp1s0 In  IP 58.37.11.251.51932 > 1.2.3.4.2022: tcp 0
30 packets captured
32 packets received by filter
0 packets dropped by kernel
```
#### tcpdump client side, client side was not able to receive packets
```
~ sudo tcpdump -iany port 2022 -c 30 -n -q
tcpdump: data link type PKTAP
tcpdump: verbose output suppressed, use -v or -vv for full protocol decode
listening on any, link-type PKTAP (Apple DLT_PKTAP), capture size 262144 bytes
02:44:29.410763 IP 192.168.0.105.51965 > 1.2.3.4.2022: tcp 0
02:44:32.005093 IP 192.168.0.105.51963 > 1.2.3.4.2022: tcp 0
02:44:32.681067 IP 192.168.0.105.51964 > 1.2.3.4.2022: tcp 0
02:44:33.427320 IP 192.168.0.105.51965 > 1.2.3.4.2022: tcp 0
02:44:38.478371 IP 192.168.0.105.51970 > 1.2.3.4.2022: tcp 0
02:44:38.936692 IP 192.168.0.105.51970 > 1.2.3.4.2022: tcp 0
02:44:39.395176 IP 192.168.0.105.51970 > 1.2.3.4.2022: tcp 0
02:44:39.798840 IP 192.168.0.105.51971 > 1.2.3.4.2022: tcp 0
02:44:39.854567 IP 192.168.0.105.51970 > 1.2.3.4.2022: tcp 0
02:44:40.258746 IP 192.168.0.105.51971 > 1.2.3.4.2022: tcp 0
02:44:40.312093 IP 192.168.0.105.51970 > 1.2.3.4.2022: tcp 0
02:44:40.718369 IP 192.168.0.105.51971 > 1.2.3.4.2022: tcp 0
02:44:40.771609 IP 192.168.0.105.51970 > 1.2.3.4.2022: tcp 0
02:44:41.177815 IP 192.168.0.105.51971 > 1.2.3.4.2022: tcp 0
02:44:41.273194 IP 192.168.0.105.51970 > 1.2.3.4.2022: tcp 0
02:44:41.636617 IP 192.168.0.105.51971 > 1.2.3.4.2022: tcp 0
02:44:42.094244 IP 192.168.0.105.51971 > 1.2.3.4.2022: tcp 0
02:44:42.277951 IP 192.168.0.105.51970 > 1.2.3.4.2022: tcp 0
02:44:42.597166 IP 192.168.0.105.51971 > 1.2.3.4.2022: tcp 0
02:44:43.601891 IP 192.168.0.105.51971 > 1.2.3.4.2022: tcp 0
02:44:44.286953 IP 192.168.0.105.51970 > 1.2.3.4.2022: tcp 0
02:44:45.611775 IP 192.168.0.105.51971 > 1.2.3.4.2022: tcp 0
02:44:48.304255 IP 192.168.0.105.51970 > 1.2.3.4.2022: tcp 0
02:44:49.629463 IP 192.168.0.105.51971 > 1.2.3.4.2022: tcp 0
02:44:56.100148 IP 192.168.0.105.51972 > 1.2.3.4.2022: tcp 0
02:44:56.558749 IP 192.168.0.105.51972 > 1.2.3.4.2022: tcp 0
02:44:57.017329 IP 192.168.0.105.51972 > 1.2.3.4.2022: tcp 0
02:44:57.476452 IP 192.168.0.105.51972 > 1.2.3.4.2022: tcp 0
02:44:57.934134 IP 192.168.0.105.51972 > 1.2.3.4.2022: tcp 0
02:44:58.392689 IP 192.168.0.105.51972 > 1.2.3.4.2022: tcp 0
30 packets captured
464 packets received by filter
0 packets dropped by kernel
```

It seems very hard to believe, I still have no idea what was going on

**Comment by zonyitoo** [comment]
Is `curl 'https://www.google.com'` working on your server?

**Comment by http600** [comment]
yes, because I can visit `google.com` through socks proxy `:1025` on local with `ssh -o ServerAliveInterval=60 -D 1025 1.2.3.4 -lroot`

**Comment by http600** [comment]
`curl google.com` is working on server
```
~# curl https://www.google.com -I
HTTP/2 200 
content-type: text/html; charset=ISO-8859-1
p3p: CP="This is not a P3P policy! See g.co/p3phelp for more info."
date: Wed, 20 Jul 2022 05:54:43 GMT
server: gws
x-xss-protection: 0
x-frame-options: SAMEORIGIN
expires: Wed, 20 Jul 2022 05:54:43 GMT
cache-control: private
set-cookie: 1P_JAR=2022-07-20-05; expires=Fri, 19-Aug-2022 05:54:43 GMT; path=/; domain=.google.com; Secure
set-cookie: AEC=AakniGNE6Gwv9xikQSEvnCkmz2bKV8DnM6SqsCPYxLjqSsTVXwCpRewkPA; expires=Mon, 16-Jan-2023 05:54:43 GMT; path=/; domain=.google.com; Secure; HttpOnly; SameSite=lax
set-cookie: NID=511=DT3mgENc1FYNTO-H4_SKzc91x2CLthgaGEQBjV3Z9X0FyvxPZV-79y0BHazEsPEzXFxqNdZXCMeS8TlV3c5QtIiQgRMRz7aFdfq_yNBmN37TcZifxBnnCdsEEJ4CBop2WYJrU88d04gerQI-EDawbxJT60ZISQzWO8V0lfNlcaM; expires=Thu, 19-Jan-2023 05:54:43 GMT; path=/; domain=.google.com; HttpOnly
alt-svc: h3=":443"; ma=2592000,h3-29=":443"; ma=2592000,h3-Q050=":443"; ma=2592000,h3-Q046=":443"; ma=2592000,h3-Q043=":443"; ma=2592000,quic=":443"; ma=2592000; v="46,43"


```

**Comment by http600** [comment]
so... I'm wondering is there anyone else can reproduce this problem or just happens to me... I have switched several oversea servers, it was reproducing constantly

**Comment by zonyitoo** [comment]
Couldn't reproduce. Don't know why.

**Comment by http600** [comment]
speechless, how stupid I was, it was firewall, the VPS vendor updated the default policy of firewall, the port was blocked by default (may have sent notification mail or something, never payed attention), until it was confirmed can not be reproduced, then I was realized why not check iptables now, it's time to confirm it at least

thank you
